{
  "last_pipeline_run": {
    "timestamp": "2025-01-15T10:30:00Z",
    "status": "success",
    "duration_seconds": 120,
    "articles_processed": 5,
    "errors": []
  },
  "system_health": {
    "status": "healthy",
    "components": {
      "api": "healthy",
      "database": "healthy",
      "storage": "healthy"
    },
    "uptime_percent": 99.9
  },
  "failures_this_week": 0,
  "last_updated": "2025-01-15T12:00:00Z"
}

